{
    "content_id": "63d98739-fc60-4e28-a65f-edb56000fd39",
    "base_path": "/topic/oil-and-gas",
    "format": "topic",
    "publishing_app": "collections-publisher",
    "rendering_app": "collections",
    "update_type": "major",
    "links": {
      "children": [
        "f6eef5ca-be55-41b2-98be-f72b3e649b84",
        "0a6116da-fbf6-4d5c-baa9-2a74ae8a8fb9"
      ]
    },
    "routes": [
      {
        "path": "/topic",
        "type": "exact"
      }
    ],
    "locale": "en",
    "public_updated_at": "2015-04-20T15:46:10.000+00:00"
}
